{
  "schema_version": 1,
  "evidence_id": "aaaaaaaa-aaaa-4aaa-8aaa-aaaaaaaaaaaa",
  "owner_id": "33333333-3333-4333-8333-333333333333",
  "host_id": "lab-global-primary",
  "kind": "backup-status",
  "status": "blocked",
  "observed_at": "2026-09-10T00:00:00Z",
  "source": {"kind": "file", "origin": "fixtures/recovery.json", "version": null, "digest": "bbbbbbbbbbbbbbbbbbbbbbbbbbbbbbbbbbbbbbbbbbbbbbbbbbbbbbbbbbbbbbbb"},
  "summary": "recovery test evidence is unavailable",
  "artifact_digest": null
}
